<?xml version="1.0" encoding="UTF-8"?>

<catalog 
    xmlns:xsi="http://www.w3.org/2001/XMLSchema-instance"
    xsi:noNamespaceSchemaLocation="catalog.xsd">

    <book id="B1" available="true">
        <title>
            <name>The Great Gatsby</name>
            <publicationYear>1925</publicationYear>
        </title>

        <author>
            <firstName>F. Scott</firstName>
            <lastName>Fitzgerald</lastName>
        </author>
    </book>

</catalog>